{
 "case": {
  "id": "SYN-HKD-0001",
  "completed_at": "2026-10-23",
  "profile": {
   "segment": "HKD",
   "product": "PP-HKD-SECURED",
   "product_name": "Vay hộ kinh doanh có TSBĐ (giả lập)",
   "flow": "FAST"
  }
 },
 "parties": [
  {
   "id": "party-1",
   "type": "INDIVIDUAL",
   "name": "TRẦN THỊ MAI",
   "identifiers": [
    {
     "type": "NATIONAL_ID",
     "value": "001192012345"
    }
   ],
   "fields": [
    {
     "path": "date_of_birth",
     "value": "1992-03-14",
     "status": "AGREED"
    },
    {
     "path": "gender",
     "value": "FEMALE",
     "status": "AGREED"
    }
   ]
  },
  {
   "id": "party-2",
   "type": "INDIVIDUAL",
   "name": "LÊ VĂN HÙNG",
   "identifiers": [
    {
     "type": "NATIONAL_ID",
     "value": "001090054321"
    }
   ],
   "fields": [
    {
     "path": "date_of_birth",
     "value": "1990-07-02",
     "status": "AGREED"
    },
    {
     "path": "gender",
     "value": "MALE",
     "status": "AGREED"
    }
   ]
  }
 ],
 "assets": [
  {
   "id": "asset-1",
   "type": "real_estate",
   "identifiers": [
    {
     "type": "CERTIFICATE_NUMBER",
     "value": "AB123456"
    }
   ],
   "fields": [
    {
     "path": "asset_type",
     "value": "real_estate",
     "status": "AGREED"
    }
   ]
  }
 ],
 "documents": {
  "items": [
   {
    "key": "legal_id_card",
    "required": true
   },
   {
    "key": "legal_qr_code_info",
    "required": false
   },
   {
    "key": "legal_vneid",
    "required": false
   },
   {
    "key": "legal_marriage_certificate",
    "required": true
   },
   {
    "key": "loan_plan_loan_application",
    "required": true
   },
   {
    "key": "loan_plan_purchase_list",
    "required": true
   },
   {
    "key": "income_general_income_statement",
    "required": true
   },
   {
    "key": "collateral_real_estate_certificate",
    "required": true
   },
   {
    "key": "collateral_valuation_certificate",
    "required": true
   },
   {
    "key": "credit_cic_report",
    "required": true
   }
  ],
  "records": [
   {
    "doc": "id_card",
    "item": "legal_id_card",
    "party": "party-1",
    "fields": [
     {
      "path": "legal_info.document_title",
      "value": "CĂN CƯỚC",
      "status": "AGREED"
     },
     {
      "path": "legal_info.document_number",
      "value": "001192012345",
      "status": "AGREED"
     },
     {
      "path": "legal_info.issuing_authority",
      "value": "BỘ CÔNG AN",
      "status": "AGREED"
     },
     {
      "path": "legal_info.issue_date",
      "value": "2024-08-20",
      "status": "AGREED"
     },
     {
      "path": "legal_info.valid_until",
      "value": "2032-03-14",
      "status": "AGREED"
     },
     {
      "path": "card_info.place_of_birth_registration",
      "value": "Xã Tân Lập, Thành phố Hà Nội",
      "status": "AGREED"
     },
     {
      "path": "parties[0].party_role",
      "value": "HOLDER",
      "status": "AGREED"
     },
     {
      "path": "parties[0].date_of_birth",
      "value": "1992-03-14",
      "status": "AGREED"
     },
     {
      "path": "parties[0].gender",
      "value": "FEMALE",
      "status": "AGREED"
     },
     {
      "path": "parties[0].nationality",
      "value": "Việt Nam",
      "status": "AGREED"
     },
     {
      "path": "parties[0].id_issue_date",
      "value": "2024-08-20",
      "status": "AGREED"
     },
     {
      "path": "parties[0].permanent_address",
      "value": {
       "street": "Thôn Đông",
       "ward": "Xã Tân Lập",
       "province": "Thành phố Hà Nội",
       "full_text": "Thôn Đông, Xã Tân Lập, Thành phố Hà Nội"
      },
      "status": "AGREED"
     }
    ]
   },
   {
    "doc": "qr_code_info",
    "item": "legal_qr_code_info",
    "party": "party-1",
    "fields": [
     {
      "path": "parties[0].party_role",
      "value": "HOLDER",
      "status": "AGREED"
     },
     {
      "path": "parties[0].date_of_birth",
      "value": "1992-03-14",
      "status": "AGREED"
     },
     {
      "path": "parties[0].gender",
      "value": "FEMALE",
      "status": "AGREED"
     },
     {
      "path": "parties[0].id_type",
      "value": "CAN_CUOC",
      "status": "AGREED"
     },
     {
      "path": "parties[0].id_issue_date",
      "value": "2024-08-20",
      "status": "AGREED"
     },
     {
      "path": "parties[0].previous_id_numbers[0]",
      "value": "012345678",
      "status": "AGREED"
     },
     {
      "path": "parties[0].permanent_address",
      "value": {
       "street": "Thôn Đông",
       "ward": "Xã Tân Lập",
       "province": "Thành phố Hà Nội",
       "full_text": "Thôn Đông, Xã Tân Lập, Thành phố Hà Nội"
      },
      "status": "AGREED"
     }
    ]
   },
   {
    "doc": "vneid",
    "item": "legal_vneid",
    "party": "party-1",
    "fields": [
     {
      "path": "legal_info.document_title",
      "value": "Thông tin cá nhân",
      "status": "AGREED"
     },
     {
      "path": "parties[0].party_role",
      "value": "HOLDER",
      "status": "AGREED"
     },
     {
      "path": "parties[0].date_of_birth",
      "value": "1992-03-14",
      "status": "AGREED"
     },
     {
      "path": "parties[0].gender",
      "value": "FEMALE",
      "status": "AGREED"
     },
     {
      "path": "parties[0].nationality",
      "value": "Việt Nam",
      "status": "AGREED"
     },
     {
      "path": "parties[0].id_type",
      "value": "CAN_CUOC",
      "status": "AGREED"
     },
     {
      "path": "parties[0].permanent_address",
      "value": {
       "street": "Thôn Đông",
       "ward": "Xã Tân Lập",
       "province": "Thành phố Hà Nội",
       "full_text": "Thôn Đông, Xã Tân Lập, Thành phố Hà Nội"
      },
      "status": "AGREED"
     },
     {
      "path": "parties[0].phone_number",
      "value": "0912000001",
      "status": "AGREED"
     }
    ]
   },
   {
    "doc": "id_card",
    "item": "legal_id_card",
    "party": "party-2",
    "fields": [
     {
      "path": "legal_info.document_title",
      "value": "CĂN CƯỚC CÔNG DÂN",
      "status": "AGREED"
     },
     {
      "path": "legal_info.document_number",
      "value": "001090054321",
      "status": "AGREED"
     },
     {
      "path": "legal_info.issuing_authority",
      "value": "Cục Cảnh sát quản lý hành chính về trật tự xã hội",
      "status": "AGREED"
     },
     {
      "path": "legal_info.issue_date",
      "value": "2023-05-10",
      "status": "AGREED"
     },
     {
      "path": "legal_info.valid_until",
      "value": "2030-07-02",
      "status": "AGREED"
     },
     {
      "path": "parties[0].party_role",
      "value": "HOLDER",
      "status": "AGREED"
     },
     {
      "path": "parties[0].date_of_birth",
      "value": "1990-07-02",
      "status": "AGREED"
     },
     {
      "path": "parties[0].gender",
      "value": "MALE",
      "status": "AGREED"
     },
     {
      "path": "parties[0].nationality",
      "value": "Việt Nam",
      "status": "AGREED"
     },
     {
      "path": "parties[0].id_issue_date",
      "value": "2023-05-10",
      "status": "AGREED"
     },
     {
      "path": "parties[0].permanent_address",
      "value": {
       "street": "Thôn Đông",
       "ward": "Xã Tân Lập",
       "province": "Thành phố Hà Nội",
       "full_text": "Thôn Đông, Xã Tân Lập, Thành phố Hà Nội"
      },
      "status": "AGREED"
     }
    ]
   },
   {
    "doc": "marriage_certificate",
    "item": "legal_marriage_certificate",
    "party": "party-1",
    "fields": [
     {
      "path": "legal_info.document_title",
      "value": "GIẤY CHỨNG NHẬN KẾT HÔN",
      "status": "AGREED"
     },
     {
      "path": "legal_info.issue_date",
      "value": "2023-04-15",
      "status": "AGREED"
     },
     {
      "path": "registration_date",
      "value": "2023-04-15",
      "status": "AGREED"
     },
     {
      "path": "place_of_registration",
      "value": "UBND Xã Tân Lập",
      "status": "AGREED"
     },
     {
      "path": "parties[0].party_role",
      "value": "WIFE",
      "status": "AGREED"
     },
     {
      "path": "parties[0].date_of_birth",
      "value": "1992-03-14",
      "status": "AGREED"
     },
     {
      "path": "parties[0].gender",
      "value": "FEMALE",
      "status": "AGREED"
     },
     {
      "path": "parties[0].nationality",
      "value": "Việt Nam",
      "status": "AGREED"
     },
     {
      "path": "parties[0].id_type",
      "value": "CCCD",
      "status": "AGREED"
     },
     {
      "path": "parties[0].id_issue_date",
      "value": "2021-03-01",
      "status": "AGREED"
     },
     {
      "path": "parties[0].id_issue_place",
      "value": "Cục Cảnh sát quản lý hành chính về trật tự xã hội",
      "status": "AGREED"
     },
     {
      "path": "parties[0].permanent_address",
      "value": {
       "street": "Thôn Đông",
       "ward": "Xã Tân Lập",
       "district": "Huyện Đan Phượng",
       "province": "Thành phố Hà Nội",
       "full_text": "Thôn Đông, Xã Tân Lập, Huyện Đan Phượng, Thành phố Hà Nội"
      },
      "status": "AGREED"
     },
     {
      "path": "parties[1].party_role",
      "value": "HUSBAND",
      "status": "AGREED"
     },
     {
      "path": "parties[1].date_of_birth",
      "value": "1990-07-02",
      "status": "AGREED"
     },
     {
      "path": "parties[1].gender",
      "value": "MALE",
      "status": "AGREED"
     },
     {
      "path": "parties[1].nationality",
      "value": "Việt Nam",
      "status": "AGREED"
     },
     {
      "path": "parties[1].id_type",
      "value": "CCCD",
      "status": "AGREED"
     },
     {
      "path": "parties[1].id_issue_date",
      "value": "2020-11-11",
      "status": "AGREED"
     },
     {
      "path": "parties[1].id_issue_place",
      "value": "Cục Cảnh sát quản lý hành chính về trật tự xã hội",
      "status": "AGREED"
     },
     {
      "path": "parties[1].permanent_address",
      "value": {
       "street": "Thôn Đông",
       "ward": "Xã Tân Lập",
       "district": "Huyện Đan Phượng",
       "province": "Thành phố Hà Nội",